{
  "schema_version": 1,
  "policy_id": "11111111-1111-4111-8111-000000000008",
  "revision_id": "11111111-1111-4111-8111-000000000009",
  "site_id": "11111111-1111-4111-8111-000000000010",
  "content_sha256": "cccccccccccccccccccccccccccccccccccccccccccccccccccccccccccccccc",
  "rules": [
    {
      "rule_id": "excavator-proximity-shadow",
      "kind": "PERSON_EQUIPMENT_PROXIMITY",
      "mode": "SHADOW",
      "threshold_m": 4.0,
      "hysteresis_m": 1.0,
      "enter_duration_ms": 1200,
      "exit_duration_ms": 1500,
      "required_geometry_level": "METRIC_VERIFIED",
      "enabled_equipment_classes": [
        "excavator"
      ],
      "zone_revision_ids": []
    }
  ],
  "created_offline": false
}
